{
	"$schema": "../../../schemas/codex-features.schema.json",
	"measuredWith": "codex-cli 0.153.4",
	"measuredAt": "2026-09-06",
	"notes": [
		"codex の [features] に何を書き、live から何を撤去するかの SSOT。settingsSync の keys / removeKeys はここから導出する（config.json に features.* を直接列挙しない）。",
		"default は空の CODEX_HOME で `codex features list` を実行した実測値。live の config.toml を読ませると実効値が返るため、必ず空の CODEX_HOME で測る。",
		"declare が false のフラグは、書いても実効値が変わらない（default と同値）か stage が removed / absent なもの。SSOT に持たず live からも撤去する。",
		"shape は codex 側のパーサが受け付ける形。table のフラグに bool を書くと明示していたサブ設定が codex 既定に戻り、fields 以外のキーを書くと config ロードごと失敗する。"
	],
	"features": {
		"memories": {
			"stage": "stable",
			"default": false,
			"shape": "bool",
			"declare": true,
			"why": "既定 off。会話をまたぐ記憶を使うため明示的に有効化する"
		},
		"context_management": {
			"stage": "under development",
			"default": false,
			"shape": "table",
			"fields": ["experimental_mode"],
			"declare": true,
			"why": "既定 off。コンテキストウィンドウをまたぐノート保持と会話履歴・ツール結果の検索を使うため有効化する。bool true も同義だが、公式が案内している table 形で持つ"
		},
		"multi_agent_v2": {
			"stage": "stable",
			"default": false,
			"shape": "table",
			"fields": [
				"enabled",
				"hide_spawn_agent_metadata",
				"tool_namespace",
				"usage_hint_enabled"
			],
			"declare": true,
			"why": "既定 off。bool にすると tool_namespace が codex 既定の collaboration に、hide_spawn_agent_metadata が true に戻るため table で明示値を保持する"
		},
		"hooks": {
			"stage": "stable",
			"default": true,
			"shape": "bool",
			"declare": false,
			"why": "default true。書いても実効値が変わらない"
		},
		"guardian_approval": {
			"stage": "stable",
			"default": true,
			"shape": "bool",
			"declare": false,
			"why": "default true。書いても実効値が変わらない"
		},
		"multi_agent": {
			"stage": "stable",
			"default": true,
			"shape": "bool",
			"declare": false,
			"why": "default true。書いても実効値が変わらない"
		},
		"goals": {
			"stage": "stable",
			"default": true,
			"shape": "bool",
			"declare": false,
			"why": "default true。書いても実効値が変わらない"
		},
		"network_proxy": {
			"stage": "experimental",
			"default": false,
			"shape": "bool",
			"declare": false,
			"why": "default false のまま使う。有効化する意図がない"
		},
		"chronicle": {
			"stage": "under development",
			"default": false,
			"shape": "bool",
			"declare": false,
			"why": "default false のまま使う。有効化する意図がない"
		},
		"terminal_resize_reflow": {
			"stage": "removed",
			"default": true,
			"shape": "bool",
			"declare": false,
			"why": "stage removed。宣言しても codex が無視する"
		},
		"js_repl": {
			"stage": "removed",
			"default": false,
			"shape": "bool",
			"declare": false,
			"why": "stage removed。宣言しても codex が無視する"
		},
		"voice_transcription": {
			"stage": "absent",
			"declare": false,
			"why": "0.153.4 の features 一覧に存在しない。過去の live 設定を撤去するためだけに残す"
		}
	}
}
